<?xml version="1.0" encoding="UTF-8"?>
<stf:sistemaTF idSistemaTF="TF001" 
xmlns:stf="http://www.piat.upm.es/sistemaTransformacion" 
xmlns:xsi="http://www.w3.org/2001/XMLSchema-instance"
xsi:schemaLocation="http://www.piat.upm.es/sistemaTransformacion sistemaTransformacion.xsd">
    <stf:informacionEntrada>
        <stf:foto>
            <stf:distancia>637</stf:distancia>
            <stf:centro>
                <stf:longitud>118</stf:longitud>
                <stf:latitud>-47</stf:latitud>
            </stf:centro>
            <stf:forma>cuadrado</stf:forma>
        </stf:foto>
    </stf:informacionEntrada>
    <stf:informacionSalida>
        <stf:imagen idImagen="IMAG001">
            <stf:dimensiones>
                286 873
            </stf:dimensiones>
            <stf:descripcion>
                esto es una descripcion
            </stf:descripcion>
            <stf:contenido formato="GIF">
                iVBORw0KGgoAAAANSUhEUgAABPQAAAKYCAIAAAB7PTEjAAAAAXNSR0IArs4c6QAAAARnQU1BAACx
            </stf:contenido>
        </stf:imagen>
    </stf:informacionSalida>
</stf:sistemaTF>